Spotify URI,Voter ID,Created,Points Assigned,Comment,Round ID
spotify:track:0uZs7p6cbEUNwGMdfNj9Kk,a2fc223a9f144363a5263c63b718a7b9,2022-02-11T19:36:04Z,1,,8b3b15ca3f1b4007bbb3a2b930b86c7f
spotify:track:24sUwrTQgrbtUdgXK94ylk,a2fc223a9f144363a5263c63b718a7b9,2022-02-11T19:36:04Z,2,I hate this. So much. ,8b3b15ca3f1b4007bbb3a2b930b86c7f
spotify:track:3VMzQ4rh7FtfSuyjHIcuZR,a2fc223a9f144363a5263c63b718a7b9,2022-02-11T19:36:04Z,2,,8b3b15ca3f1b4007bbb3a2b930b86c7f
spotify:track:4ESUWYq4QIHmgTjKYVhSJw,a2fc223a9f144363a5263c63b718a7b9,2022-02-11T19:36:04Z,1,,8b3b15ca3f1b4007bbb3a2b930b86c7f
spotify:track:5ygDXis42ncn6kYG14lEVG,a2fc223a9f144363a5263c63b718a7b9,2022-02-11T19:36:04Z,1,,8b3b15ca3f1b4007bbb3a2b930b86c7f
spotify:track:69J6ACHVb8xEIbMNl8U7st,a2fc223a9f144363a5263c63b718a7b9,2022-02-11T19:36:04Z,1,,8b3b15ca3f1b4007bbb3a2b930b86c7f
spotify:track:0O0pn82JUSSDzZvvqQCalX,9e5c0f25c78544de921a2a52b9412022,2022-02-11T21:31:35Z,0,This makes sense. I also can’t bring myself to go down the path that awards this points. I’m sorry.,8b3b15ca3f1b4007bbb3a2b930b86c7f
spotify:track:0uZs7p6cbEUNwGMdfNj9Kk,9e5c0f25c78544de921a2a52b9412022,2022-02-11T21:31:35Z,0,"This gets points if I take a totally different approach to scoring, but this was difficult. ",8b3b15ca3f1b4007bbb3a2b930b86c7f
spotify:track:24sUwrTQgrbtUdgXK94ylk,9e5c0f25c78544de921a2a52b9412022,2022-02-11T21:31:35Z,2,"Yep. *shakes head* … idk what else to say, take your filthy two points.",8b3b15ca3f1b4007bbb3a2b930b86c7f
spotify:track:2BBG2uGJptuZK79xJJoeUx,9e5c0f25c78544de921a2a52b9412022,2022-02-11T21:31:35Z,4,You had me at “hey kids”.,8b3b15ca3f1b4007bbb3a2b930b86c7f
spotify:track:7n94AQ0n28PeUfflgFifth,9e5c0f25c78544de921a2a52b9412022,2022-02-11T21:31:35Z,0,"This gets points if I take a totally different approach to scoring, but this was difficult. ",8b3b15ca3f1b4007bbb3a2b930b86c7f
spotify:track:4nuUssdgKFy2QyYHHNkZQW,9e5c0f25c78544de921a2a52b9412022,2022-02-11T21:31:35Z,0,"This gets points if I take a totally different approach to scoring, but this was difficult. ",8b3b15ca3f1b4007bbb3a2b930b86c7f
spotify:track:4ESUWYq4QIHmgTjKYVhSJw,9e5c0f25c78544de921a2a52b9412022,2022-02-11T21:31:35Z,0,Perhaps you missed the “wrong answers only” part of the prompt.,8b3b15ca3f1b4007bbb3a2b930b86c7f
spotify:track:3VMzQ4rh7FtfSuyjHIcuZR,9e5c0f25c78544de921a2a52b9412022,2022-02-11T21:31:35Z,1,"I wish I weren’t giving this points, but I need consistency across my votes and this is distinctly in the category of the other point-getters, so here is one.",8b3b15ca3f1b4007bbb3a2b930b86c7f
spotify:track:2Vo0CHZltnh18JAPNOSfS3,9e5c0f25c78544de921a2a52b9412022,2022-02-11T21:31:35Z,3,Talking to kids? In,8b3b15ca3f1b4007bbb3a2b930b86c7f
spotify:track:47BBI51FKFwOMlIiX6m8ya,36d943fd539042239fb5646d50d0a9ad,2022-02-16T01:16:43Z,2,"I can see a crowd getting into this, even if I would never sing it.",3d5a0ec86dc54449820f82209bda25e3
spotify:track:37ZJ0p5Jm13JPevGcx4SkF,36d943fd539042239fb5646d50d0a9ad,2022-02-16T01:16:43Z,2,Too long but this is a great karaoke track otherwise,3d5a0ec86dc54449820f82209bda25e3
spotify:track:2WfaOiMkCvy7F5fcp2zZ8L,36d943fd539042239fb5646d50d0a9ad,2022-02-16T01:16:43Z,2,"This song is nearly impossible to sing well, so if you can actually pull this off, respect, but most people can't.  Still, it would pump up the crowd.",3d5a0ec86dc54449820f82209bda25e3
spotify:track:0qxtQ8rf3W1nId3D2r0xH4,36d943fd539042239fb5646d50d0a9ad,2022-02-16T01:16:43Z,0,"Hard to find 3 people who would want to sing this song and also not enough energy, though it does have nostaglia.",3d5a0ec86dc54449820f82209bda25e3
spotify:track:0QULNNd9z5s35entfiiXoa,36d943fd539042239fb5646d50d0a9ad,2022-02-16T01:16:43Z,0,Too long but I can see how it would pump up the crowd,3d5a0ec86dc54449820f82209bda25e3
spotify:track:0kYUrLVQOfx21xuXu7OGrT,36d943fd539042239fb5646d50d0a9ad,2022-02-16T01:16:43Z,0,Too long for a good karaoke song but otherwise good energy,3d5a0ec86dc54449820f82209bda25e3
spotify:track:4bHsxqR3GMrXTxEPLuK5ue,36d943fd539042239fb5646d50d0a9ad,2022-02-16T01:16:43Z,2,"Cliched but for a reason, would get the crowd pumped for sure (because they're all drunk)",3d5a0ec86dc54449820f82209bda25e3
spotify:track:4W4wYHtsrgDiivRASVOINL,36d943fd539042239fb5646d50d0a9ad,2022-02-16T01:16:43Z,0,I'm sorry Michelle but I hate it when this is sung at karaoke...it's ridiculously too long.,3d5a0ec86dc54449820f82209bda25e3
spotify:track:6ihL9TjfRjadfEePzXXyVF,36d943fd539042239fb5646d50d0a9ad,2022-02-16T01:16:43Z,0,Not enough energy.,3d5a0ec86dc54449820f82209bda25e3
spotify:track:6l8GvAyoUZwWDgF1e4822w,36d943fd539042239fb5646d50d0a9ad,2022-02-16T01:16:43Z,0,"Incredible song, way way too long for karaoke, and nearly impossible to sing well unless you have training.",3d5a0ec86dc54449820f82209bda25e3
spotify:track:7dzUZec5MnWMyQnk5klnKR,36d943fd539042239fb5646d50d0a9ad,2022-02-16T01:16:43Z,2,I don't know this song but I'm into it and I would enjoy singing along to it while drunk.,3d5a0ec86dc54449820f82209bda25e3
spotify:track:7GgWAITsYJaRM3r50rfh5w,36d943fd539042239fb5646d50d0a9ad,2022-02-16T01:16:43Z,0,Way too long and why not a more well known Adele jam?,3d5a0ec86dc54449820f82209bda25e3
spotify:track:0qxtQ8rf3W1nId3D2r0xH4,b1d3b6bb237f476daab860bce327dbd6,2022-02-16T01:23:56Z,1,I would giggle,3d5a0ec86dc54449820f82209bda25e3
spotify:track:2WfaOiMkCvy7F5fcp2zZ8L,b1d3b6bb237f476daab860bce327dbd6,2022-02-16T01:23:56Z,3,HECK YES. ,3d5a0ec86dc54449820f82209bda25e3
spotify:track:47BBI51FKFwOMlIiX6m8ya,b1d3b6bb237f476daab860bce327dbd6,2022-02-16T01:23:56Z,1,Yesssssssssssssssssssssssss,3d5a0ec86dc54449820f82209bda25e3
spotify:track:4bHsxqR3GMrXTxEPLuK5ue,b1d3b6bb237f476daab860bce327dbd6,2022-02-16T01:23:56Z,0,*gag*,3d5a0ec86dc54449820f82209bda25e3
spotify:track:4W4wYHtsrgDiivRASVOINL,b1d3b6bb237f476daab860bce327dbd6,2022-02-16T01:23:56Z,5,This is my karaoke jam. I strongly considered submitting this one. Hell yes.,3d5a0ec86dc54449820f82209bda25e3
spotify:track:6l8GvAyoUZwWDgF1e4822w,b1d3b6bb237f476daab860bce327dbd6,2022-02-16T01:23:56Z,0,"If someone tried to do this at karaoke and I was drunk enough, I would consider tackling them. This is a LONG song.",3d5a0ec86dc54449820f82209bda25e3
spotify:track:4bHsxqR3GMrXTxEPLuK5ue,ee68d303b28a4bad8e749d599ee7ea1d,2022-02-16T08:02:16Z,2,,3d5a0ec86dc54449820f82209bda25e3
spotify:track:6l8GvAyoUZwWDgF1e4822w,ee68d303b28a4bad8e749d599ee7ea1d,2022-02-16T08:02:16Z,2,,3d5a0ec86dc54449820f82209bda25e3
spotify:track:6ihL9TjfRjadfEePzXXyVF,ee68d303b28a4bad8e749d599ee7ea1d,2022-02-16T08:02:16Z,1,,3d5a0ec86dc54449820f82209bda25e3
spotify:track:37ZJ0p5Jm13JPevGcx4SkF,ee68d303b28a4bad8e749d599ee7ea1d,2022-02-16T08:02:16Z,2,,3d5a0ec86dc54449820f82209bda25e3
spotify:track:2WfaOiMkCvy7F5fcp2zZ8L,ee68d303b28a4bad8e749d599ee7ea1d,2022-02-16T08:02:16Z,1,,3d5a0ec86dc54449820f82209bda25e3
spotify:track:0qxtQ8rf3W1nId3D2r0xH4,ee68d303b28a4bad8e749d599ee7ea1d,2022-02-16T08:02:16Z,1,,3d5a0ec86dc54449820f82209bda25e3
spotify:track:0kYUrLVQOfx21xuXu7OGrT,ee68d303b28a4bad8e749d599ee7ea1d,2022-02-16T08:02:16Z,1,,3d5a0ec86dc54449820f82209bda25e3
spotify:track:0qxtQ8rf3W1nId3D2r0xH4,9e5c0f25c78544de921a2a52b9412022,2022-02-16T09:01:17Z,0,"lots of thoughts condensed down: most people don’t know all the lyrics to this thing and it’ll disappoint more than you’d expect. Solid choice to vibe, but won’t bring down the house.",3d5a0ec86dc54449820f82209bda25e3
spotify:track:0kYUrLVQOfx21xuXu7OGrT,9e5c0f25c78544de921a2a52b9412022,2022-02-16T09:01:17Z,0,"killers is a great choice particularly for someone with a solid voice, but this song wasn’t popular enough to beat some other heavy hitters at pumping up the crowd in the “everyone join in” way.",3d5a0ec86dc54449820f82209bda25e3
spotify:track:29SyMC0plk6qw8NMF7lfRL,9e5c0f25c78544de921a2a52b9412022,2022-02-16T09:01:17Z,0,"solid choice, but the crowd needs a heavy Gen-X or older feel for this to get them moving anywhere near the efficacy of journey or some 90s boy band action. Stiff competition.",3d5a0ec86dc54449820f82209bda25e3
spotify:track:2WfaOiMkCvy7F5fcp2zZ8L,9e5c0f25c78544de921a2a52b9412022,2022-02-16T09:01:17Z,0,solid everyone-join-in chorus but those notes are really high and the other lyrics are likely to lose the crowd in that same “solid B” choice. Tough competition keeps this out of 1-2 points,3d5a0ec86dc54449820f82209bda25e3
spotify:track:0QULNNd9z5s35entfiiXoa,9e5c0f25c78544de921a2a52b9412022,2022-02-16T09:01:17Z,0,"the lyrics are great for the theme, particularly late in the night, but I can see it whiffing with some crowds because it isn’t adequately well known outside the chorus.",3d5a0ec86dc54449820f82209bda25e3
spotify:track:37ZJ0p5Jm13JPevGcx4SkF,9e5c0f25c78544de921a2a52b9412022,2022-02-16T09:01:17Z,1,Damnit. Solid middle tier of these strong choices. Gj taking a point from BSB.,3d5a0ec86dc54449820f82209bda25e3
spotify:track:47BBI51FKFwOMlIiX6m8ya,9e5c0f25c78544de921a2a52b9412022,2022-02-16T09:01:17Z,3,"first of all, ByeByeBye is the correct boy band choice, but I chose Queen and can’t fault the BSB nod. Congrats on the podium. (I always choose stuff that gets everyone to join in and this is one of the go-tos)",3d5a0ec86dc54449820f82209bda25e3
spotify:track:4bHsxqR3GMrXTxEPLuK5ue,9e5c0f25c78544de921a2a52b9412022,2022-02-16T09:01:17Z,4,"okay so this is obviously total gasoline and should podium. Counterpoint: I’ve been to multiple karaoke bars with rules around no journey or you have to pay $ to sing journey because it is so overdone. Seems like hitting it out of the park to me, gj!",3d5a0ec86dc54449820f82209bda25e3
spotify:track:4W4wYHtsrgDiivRASVOINL,9e5c0f25c78544de921a2a52b9412022,2022-02-16T09:01:17Z,1,"great for an older crowd, and though not as good as some others, it will get several people pumped for sure though, so it can’t go empty handed.",3d5a0ec86dc54449820f82209bda25e3
spotify:track:6ihL9TjfRjadfEePzXXyVF,9e5c0f25c78544de921a2a52b9412022,2022-02-16T09:01:17Z,1,"damnit, this is a dark horse with legs. New enough to hit the actual Karaoke crowd and old enough to be cool to most millennials and some Gen-x. Taking points from the obvious podium choices.",3d5a0ec86dc54449820f82209bda25e3
spotify:track:7dzUZec5MnWMyQnk5klnKR,9e5c0f25c78544de921a2a52b9412022,2022-02-16T09:01:17Z,0," I love this song, especially the whiffenpoofs version, but I don’t think the crowd would get pumped unless the singer was just killing it and bringing down the house. ",3d5a0ec86dc54449820f82209bda25e3
spotify:track:7GgWAITsYJaRM3r50rfh5w,9e5c0f25c78544de921a2a52b9412022,2022-02-16T09:01:17Z,0,"everybody loves Adele, but this song isn’t well known enough to compete with other submissions.",3d5a0ec86dc54449820f82209bda25e3
spotify:track:4W4wYHtsrgDiivRASVOINL,b0415b544bb44324a6afca46625ea1a7,2022-02-16T13:28:13Z,3,"I used to do this song. It works as a great duet to get people up on stage who wouldn't go on their own. I used to stomp on the stage at the 'bang bangs', but once it made the CD skip which led to quite the awkward silence.",3d5a0ec86dc54449820f82209bda25e3
spotify:track:7GgWAITsYJaRM3r50rfh5w,b0415b544bb44324a6afca46625ea1a7,2022-02-16T13:28:13Z,0,"Ugh. Adele... I know I'm in the minority, but I just *don't* like her stuff.",3d5a0ec86dc54449820f82209bda25e3
spotify:track:0QULNNd9z5s35entfiiXoa,b0415b544bb44324a6afca46625ea1a7,2022-02-16T13:28:13Z,0,"Seems fun, but I didn't recognize it. I worry most middle 'mericans in a bar wouldn't either.",3d5a0ec86dc54449820f82209bda25e3
spotify:track:0qxtQ8rf3W1nId3D2r0xH4,b0415b544bb44324a6afca46625ea1a7,2022-02-16T13:28:13Z,2,Never seen this one attempted. Seems like it could be fun?,3d5a0ec86dc54449820f82209bda25e3
spotify:track:2WfaOiMkCvy7F5fcp2zZ8L,b0415b544bb44324a6afca46625ea1a7,2022-02-16T13:28:13Z,2,I've seem some truly disastrous and ill-advised attempts at this song. Points for those in the crowd who enjoy schadenfreude.,3d5a0ec86dc54449820f82209bda25e3
spotify:track:47BBI51FKFwOMlIiX6m8ya,b0415b544bb44324a6afca46625ea1a7,2022-02-16T13:28:13Z,2,A bachelorette party standard.,3d5a0ec86dc54449820f82209bda25e3
spotify:track:6l8GvAyoUZwWDgF1e4822w,b0415b544bb44324a6afca46625ea1a7,2022-02-16T13:28:13Z,1,"I would've put in Mr. Roboto (a song I loved to karaoke), but it suffers the same problem as Bohemian Rhapsody: it's too long. This song gets people pumped, but rarely can the enthusiasm make it to the conclusion.",3d5a0ec86dc54449820f82209bda25e3
spotify:track:7dzUZec5MnWMyQnk5klnKR,19eff85db4e848b5883f12fff6042b18,2022-02-16T18:52:22Z,1,,3d5a0ec86dc54449820f82209bda25e3
spotify:track:37ZJ0p5Jm13JPevGcx4SkF,19eff85db4e848b5883f12fff6042b18,2022-02-16T18:52:22Z,3,This is the right answer all the time. Kareoke night should just be everyone taking turns singing Livin' on a Prayer. Constant hype!,3d5a0ec86dc54449820f82209bda25e3
spotify:track:47BBI51FKFwOMlIiX6m8ya,19eff85db4e848b5883f12fff6042b18,2022-02-16T18:52:22Z,2,,3d5a0ec86dc54449820f82209bda25e3
spotify:track:4bHsxqR3GMrXTxEPLuK5ue,19eff85db4e848b5883f12fff6042b18,2022-02-16T18:52:22Z,1,,3d5a0ec86dc54449820f82209bda25e3
spotify:track:6l8GvAyoUZwWDgF1e4822w,19eff85db4e848b5883f12fff6042b18,2022-02-16T18:52:22Z,1,,3d5a0ec86dc54449820f82209bda25e3
spotify:track:7GgWAITsYJaRM3r50rfh5w,19eff85db4e848b5883f12fff6042b18,2022-02-16T18:52:22Z,2,,3d5a0ec86dc54449820f82209bda25e3
spotify:track:4W4wYHtsrgDiivRASVOINL,395e5c719c574cbd81ec148a0e6a28c6,2022-02-17T20:18:04Z,0,I'm looking to give my points to something less obvious,3d5a0ec86dc54449820f82209bda25e3
spotify:track:4bHsxqR3GMrXTxEPLuK5ue,395e5c719c574cbd81ec148a0e6a28c6,2022-02-17T20:18:04Z,0,I'm looking to give my points to something less obvious,3d5a0ec86dc54449820f82209bda25e3
spotify:track:37ZJ0p5Jm13JPevGcx4SkF,395e5c719c574cbd81ec148a0e6a28c6,2022-02-17T20:18:04Z,0,I'm looking to give my points to something less obvious,3d5a0ec86dc54449820f82209bda25e3
spotify:track:2WfaOiMkCvy7F5fcp2zZ8L,395e5c719c574cbd81ec148a0e6a28c6,2022-02-17T20:18:04Z,0,I'm looking to give my points to something less obvious,3d5a0ec86dc54449820f82209bda25e3
spotify:track:29SyMC0plk6qw8NMF7lfRL,395e5c719c574cbd81ec148a0e6a28c6,2022-02-17T20:18:04Z,0,I think it needs to be a smidge faster to be a crowd pumper,3d5a0ec86dc54449820f82209bda25e3
spotify:track:0QULNNd9z5s35entfiiXoa,395e5c719c574cbd81ec148a0e6a28c6,2022-02-17T20:18:04Z,3,"The crowd will get pumped up, yes, especially if they are also drunk",3d5a0ec86dc54449820f82209bda25e3
spotify:track:0kYUrLVQOfx21xuXu7OGrT,395e5c719c574cbd81ec148a0e6a28c6,2022-02-17T20:18:04Z,2,It's a song with a beat and some of it is sing-along-able for that pump factor,3d5a0ec86dc54449820f82209bda25e3
spotify:track:7GgWAITsYJaRM3r50rfh5w,395e5c719c574cbd81ec148a0e6a28c6,2022-02-17T20:18:04Z,1,"I'm going to give a point for having the boldness to submit a slow song.  There are better choices, but it helped me see a different side of the prompt.",3d5a0ec86dc54449820f82209bda25e3
spotify:track:47BBI51FKFwOMlIiX6m8ya,395e5c719c574cbd81ec148a0e6a28c6,2022-02-17T20:18:04Z,0,I'm looking to give my points to something less obvious,3d5a0ec86dc54449820f82209bda25e3
spotify:track:7dzUZec5MnWMyQnk5klnKR,395e5c719c574cbd81ec148a0e6a28c6,2022-02-17T20:18:04Z,3,"If performed really well, I could see this as a crowd pumper.  It's going to require a LOT of energy from the performer though (high activation energy).",3d5a0ec86dc54449820f82209bda25e3
spotify:track:6l8GvAyoUZwWDgF1e4822w,395e5c719c574cbd81ec148a0e6a28c6,2022-02-17T20:18:04Z,1,"1 point for the nostalgia factor. At camp there was a group of teenage guys who began every day lip syncing either this song or Billy Joel's ""Tell Her About It"" and it always pumped me up as a youths",3d5a0ec86dc54449820f82209bda25e3
spotify:track:6l8GvAyoUZwWDgF1e4822w,43c8053c706643709c37d432b5118001,2022-02-18T01:07:31Z,1,"I enjoy this song, but feel it's too long for Karaoke",3d5a0ec86dc54449820f82209bda25e3
spotify:track:0kYUrLVQOfx21xuXu7OGrT,43c8053c706643709c37d432b5118001,2022-02-18T01:07:31Z,5,"The UK music video for this is my favorite, the US one is dumb as hell",3d5a0ec86dc54449820f82209bda25e3
spotify:track:47BBI51FKFwOMlIiX6m8ya,43c8053c706643709c37d432b5118001,2022-02-18T01:07:31Z,2,You're hitting me right in my nostalgia,3d5a0ec86dc54449820f82209bda25e3
spotify:track:4W4wYHtsrgDiivRASVOINL,43c8053c706643709c37d432b5118001,2022-02-18T01:07:31Z,1,"Whenever I hear B-52's I'm always like ""ugh"" but they have so many bops",3d5a0ec86dc54449820f82209bda25e3
spotify:track:7dzUZec5MnWMyQnk5klnKR,43c8053c706643709c37d432b5118001,2022-02-18T01:07:31Z,1,I only know this song because or Ryan Reynolds,3d5a0ec86dc54449820f82209bda25e3
spotify:track:6l8GvAyoUZwWDgF1e4822w,d21152e7d3cd4a69b0951abdfe3e1480,2022-02-18T09:55:10Z,0,"Sure it's a classic, but I'd never put this on at a karaoke bar!",3d5a0ec86dc54449820f82209bda25e3
spotify:track:7dzUZec5MnWMyQnk5klnKR,d21152e7d3cd4a69b0951abdfe3e1480,2022-02-18T09:55:10Z,0,If someone nailed this at karaoke I would be incredibly surprised,3d5a0ec86dc54449820f82209bda25e3
spotify:track:4bHsxqR3GMrXTxEPLuK5ue,d21152e7d3cd4a69b0951abdfe3e1480,2022-02-18T09:55:10Z,3,,3d5a0ec86dc54449820f82209bda25e3
spotify:track:37ZJ0p5Jm13JPevGcx4SkF,d21152e7d3cd4a69b0951abdfe3e1480,2022-02-18T09:55:10Z,3,,3d5a0ec86dc54449820f82209bda25e3
spotify:track:29SyMC0plk6qw8NMF7lfRL,d21152e7d3cd4a69b0951abdfe3e1480,2022-02-18T09:55:10Z,4,,3d5a0ec86dc54449820f82209bda25e3
spotify:track:29SyMC0plk6qw8NMF7lfRL,b980e47a32c74ddb9f30e77e1959157a,2022-02-18T16:52:17Z,0,"Has the right energy, buy for karaoke I need a hook the crowd can join in with. And there are better options on the playlist.",3d5a0ec86dc54449820f82209bda25e3
spotify:track:0qxtQ8rf3W1nId3D2r0xH4,b980e47a32c74ddb9f30e77e1959157a,2022-02-18T16:52:17Z,2,"We're just insistent on forcing The Lion King into Music League, eh? I'd be sticking the ""out of line, but right"" meme here if I could.",3d5a0ec86dc54449820f82209bda25e3
spotify:track:0kYUrLVQOfx21xuXu7OGrT,b980e47a32c74ddb9f30e77e1959157a,2022-02-18T16:52:17Z,0,"I want to give you a point for not picking one of the obvious Killers songs. I won't, but I want to.",3d5a0ec86dc54449820f82209bda25e3
spotify:track:4W4wYHtsrgDiivRASVOINL,b980e47a32c74ddb9f30e77e1959157a,2022-02-18T16:52:17Z,1,"Solid choice. I really would like to give this 2 points, but I don't have enough to go around. Sorry.",3d5a0ec86dc54449820f82209bda25e3
spotify:track:6ihL9TjfRjadfEePzXXyVF,b980e47a32c74ddb9f30e77e1959157a,2022-02-18T16:52:17Z,0,"I dig it, but I feel like this song needs to get too deep in before it would really grab a crowd.",3d5a0ec86dc54449820f82209bda25e3
spotify:track:6l8GvAyoUZwWDgF1e4822w,b980e47a32c74ddb9f30e77e1959157a,2022-02-18T16:52:17Z,0,"I've tried doing this song at karaoke, it was a disaster. If someone could pull it off I'd be impressed, but not pumped.",3d5a0ec86dc54449820f82209bda25e3
spotify:track:7dzUZec5MnWMyQnk5klnKR,b980e47a32c74ddb9f30e77e1959157a,2022-02-18T16:52:17Z,0,"I love this song, but I think it is niche enough it could land flat with the wrong crowd.",3d5a0ec86dc54449820f82209bda25e3
spotify:track:7GgWAITsYJaRM3r50rfh5w,b980e47a32c74ddb9f30e77e1959157a,2022-02-18T16:52:17Z,0,"I can see a crowd being impressed at a well done version of this, but it doesn't have pump up energy.",3d5a0ec86dc54449820f82209bda25e3
spotify:track:4bHsxqR3GMrXTxEPLuK5ue,b980e47a32c74ddb9f30e77e1959157a,2022-02-18T16:52:17Z,1,"Obviously choice is obvious. But not wrong, so point.",3d5a0ec86dc54449820f82209bda25e3
spotify:track:47BBI51FKFwOMlIiX6m8ya,b980e47a32c74ddb9f30e77e1959157a,2022-02-18T16:52:17Z,3,I've seen enough roomfuls of strangers bust into song to know how a crowd can react when this comes on.,3d5a0ec86dc54449820f82209bda25e3
spotify:track:37ZJ0p5Jm13JPevGcx4SkF,b980e47a32c74ddb9f30e77e1959157a,2022-02-18T16:52:17Z,1,"Obviously choice is obvious. But not wrong, so point.",3d5a0ec86dc54449820f82209bda25e3
spotify:track:2WfaOiMkCvy7F5fcp2zZ8L,b980e47a32c74ddb9f30e77e1959157a,2022-02-18T16:52:17Z,2,The crowd can get on board without actually knowing lyrics. Solid choice.,3d5a0ec86dc54449820f82209bda25e3
spotify:track:47BBI51FKFwOMlIiX6m8ya,a2fc223a9f144363a5263c63b718a7b9,2022-02-18T21:17:05Z,3,,3d5a0ec86dc54449820f82209bda25e3
spotify:track:4bHsxqR3GMrXTxEPLuK5ue,a2fc223a9f144363a5263c63b718a7b9,2022-02-18T21:17:05Z,0,You stole my song! No points for you!!,3d5a0ec86dc54449820f82209bda25e3
spotify:track:4W4wYHtsrgDiivRASVOINL,a2fc223a9f144363a5263c63b718a7b9,2022-02-18T21:17:05Z,3,,3d5a0ec86dc54449820f82209bda25e3
spotify:track:29SyMC0plk6qw8NMF7lfRL,a2fc223a9f144363a5263c63b718a7b9,2022-02-18T21:17:05Z,2,,3d5a0ec86dc54449820f82209bda25e3
spotify:track:2WfaOiMkCvy7F5fcp2zZ8L,a2fc223a9f144363a5263c63b718a7b9,2022-02-18T21:17:05Z,2,,3d5a0ec86dc54449820f82209bda25e3
spotify:track:6ihL9TjfRjadfEePzXXyVF,e1a362ba4ee648dd9f6f5e72bba8144a,2022-02-18T21:41:50Z,3,,3d5a0ec86dc54449820f82209bda25e3
spotify:track:0kYUrLVQOfx21xuXu7OGrT,e1a362ba4ee648dd9f6f5e72bba8144a,2022-02-18T21:41:50Z,1,,3d5a0ec86dc54449820f82209bda25e3
spotify:track:2WfaOiMkCvy7F5fcp2zZ8L,e1a362ba4ee648dd9f6f5e72bba8144a,2022-02-18T21:41:50Z,3,It never gets old!,3d5a0ec86dc54449820f82209bda25e3
spotify:track:47BBI51FKFwOMlIiX6m8ya,e1a362ba4ee648dd9f6f5e72bba8144a,2022-02-18T21:41:50Z,0,I’m the bad millennial who never liked boy bands,3d5a0ec86dc54449820f82209bda25e3
spotify:track:4bHsxqR3GMrXTxEPLuK5ue,e1a362ba4ee648dd9f6f5e72bba8144a,2022-02-18T21:41:50Z,3,S-tier drunk sing along,3d5a0ec86dc54449820f82209bda25e3
spotify:track:29SyMC0plk6qw8NMF7lfRL,da5f8027cd7b421998ef6b381ebe6256,2022-02-18T21:50:27Z,0,"I do like this song, but don't get the karaoke pump-up vibe from it",3d5a0ec86dc54449820f82209bda25e3
spotify:track:6ihL9TjfRjadfEePzXXyVF,da5f8027cd7b421998ef6b381ebe6256,2022-02-18T21:50:27Z,1,I could see the crowd getting into this,3d5a0ec86dc54449820f82209bda25e3
spotify:track:2WfaOiMkCvy7F5fcp2zZ8L,da5f8027cd7b421998ef6b381ebe6256,2022-02-18T21:50:27Z,0,If you nail this (especially if you don't look like you can) I think that'd pump up the crowd,3d5a0ec86dc54449820f82209bda25e3
spotify:track:4bHsxqR3GMrXTxEPLuK5ue,da5f8027cd7b421998ef6b381ebe6256,2022-02-18T21:50:27Z,1,"Obvious answer, but minus points for stealing my wife's first choice song",3d5a0ec86dc54449820f82209bda25e3
spotify:track:47BBI51FKFwOMlIiX6m8ya,da5f8027cd7b421998ef6b381ebe6256,2022-02-18T21:50:27Z,3,Obvious answer is obvious,3d5a0ec86dc54449820f82209bda25e3
spotify:track:37ZJ0p5Jm13JPevGcx4SkF,da5f8027cd7b421998ef6b381ebe6256,2022-02-18T21:50:27Z,3,Obvious answer is obvious,3d5a0ec86dc54449820f82209bda25e3
spotify:track:6l8GvAyoUZwWDgF1e4822w,da5f8027cd7b421998ef6b381ebe6256,2022-02-18T21:50:27Z,2,I was tempted to dock points for the longer instrumental interludes but I think lots of people would still just sing along,3d5a0ec86dc54449820f82209bda25e3
