Spotify URI,Voter ID,Created,Points Assigned,Comment,Round ID
spotify:track:7rlCeTnjn0plPZkVAcctPZ,b1d3b6bb237f476daab860bce327dbd6,2022-01-28T04:07:29Z,1,"Yesssss, I actually had to take points away from something else to give this one some. Excellent submission!",40da6a2d5b204e1a865d8b31e98c43c9
spotify:track:1IsGA5ceSC4a5nxgAEYnQd,19eff85db4e848b5883f12fff6042b18,2022-01-28T04:46:39Z,1,,40da6a2d5b204e1a865d8b31e98c43c9
spotify:track:1SJhYNxOZSItqrB6upWyE6,19eff85db4e848b5883f12fff6042b18,2022-01-28T04:46:39Z,1,,40da6a2d5b204e1a865d8b31e98c43c9
spotify:track:27NovPIUIRrOZoCHxABJwK,19eff85db4e848b5883f12fff6042b18,2022-01-28T04:46:39Z,1,,40da6a2d5b204e1a865d8b31e98c43c9
spotify:track:2T5Ch09nefwckOu5NQvjIk,19eff85db4e848b5883f12fff6042b18,2022-01-28T04:46:39Z,2,,40da6a2d5b204e1a865d8b31e98c43c9
spotify:track:5ARrtxJLVCeTv5TWo1oKgC,19eff85db4e848b5883f12fff6042b18,2022-01-28T04:46:39Z,2,,40da6a2d5b204e1a865d8b31e98c43c9
spotify:track:5W8YXBz9MTIDyrpYaCg2Ky,19eff85db4e848b5883f12fff6042b18,2022-01-28T04:46:39Z,2,,40da6a2d5b204e1a865d8b31e98c43c9
spotify:track:6MCYY4i1zrRIbVj9YlVUdF,19eff85db4e848b5883f12fff6042b18,2022-01-28T04:46:39Z,1,,40da6a2d5b204e1a865d8b31e98c43c9
spotify:track:19NQ0LL9TbSgqPzidSwGMU,b980e47a32c74ddb9f30e77e1959157a,2022-01-28T05:44:31Z,0,"Like it, but neither lyrically nor melodically what I need given the prompt.",40da6a2d5b204e1a865d8b31e98c43c9
spotify:track:1diS6nkxMQc3wwC4G1j0bh,b980e47a32c74ddb9f30e77e1959157a,2022-01-28T05:44:31Z,0,"Decent song, but I'm more likely to put this on a playlist of songs I'm walking out to.",40da6a2d5b204e1a865d8b31e98c43c9
spotify:track:1IsGA5ceSC4a5nxgAEYnQd,b980e47a32c74ddb9f30e77e1959157a,2022-01-28T05:44:31Z,1,The masochist in me approves.,40da6a2d5b204e1a865d8b31e98c43c9
spotify:track:1SJhYNxOZSItqrB6upWyE6,b980e47a32c74ddb9f30e77e1959157a,2022-01-28T05:44:31Z,1,"Damn, Steven Universe! This song would be a home run on some playlists, but I feel like I would be listening to this while crying in the walk-in cooler. Which I guess is technically keeping me from walking off...",40da6a2d5b204e1a865d8b31e98c43c9
spotify:track:27NovPIUIRrOZoCHxABJwK,b980e47a32c74ddb9f30e77e1959157a,2022-01-28T05:44:31Z,1,"The world does not deserve Lil Nas X. Right tempo, title works, but I think I have to stop at 1 point.",40da6a2d5b204e1a865d8b31e98c43c9
spotify:track:2rtGaCAeYtmcIvuZsvgTf6,b980e47a32c74ddb9f30e77e1959157a,2022-01-28T05:44:31Z,0,Not the vibe I need when trying to not lose my shit at work.,40da6a2d5b204e1a865d8b31e98c43c9
spotify:track:2T5Ch09nefwckOu5NQvjIk,b980e47a32c74ddb9f30e77e1959157a,2022-01-28T05:44:31Z,1,Clever. Worth a point.,40da6a2d5b204e1a865d8b31e98c43c9
spotify:track:2zfJ7nQiIGfy6BRuMuuLSX,b980e47a32c74ddb9f30e77e1959157a,2022-01-28T05:44:31Z,0,"I get it, I'm just not feeling it.",40da6a2d5b204e1a865d8b31e98c43c9
spotify:track:5ARrtxJLVCeTv5TWo1oKgC,b980e47a32c74ddb9f30e77e1959157a,2022-01-28T05:44:31Z,0,"If I'm at the breaking point I need something to burn off the energy. So good song, but of no help to me here.",40da6a2d5b204e1a865d8b31e98c43c9
spotify:track:5JFkuKQsPps2ZaZzaLx63d,b980e47a32c74ddb9f30e77e1959157a,2022-01-28T05:44:31Z,1,"I think this is the closest to calm I get when trying to calm down. So I can give it a point, but only 1 as I'm probably hitting skip before it's over.",40da6a2d5b204e1a865d8b31e98c43c9
spotify:track:5W8YXBz9MTIDyrpYaCg2Ky,b980e47a32c74ddb9f30e77e1959157a,2022-01-28T05:44:31Z,2,"Points, because I have 100% blasted this song into my ears in an attempt to not go absolute ape on someone.",40da6a2d5b204e1a865d8b31e98c43c9
spotify:track:5WJ92b9eMC0xZ7BaukU1E4,b980e47a32c74ddb9f30e77e1959157a,2022-01-28T05:44:31Z,1,No one in the history of ever has relaxed after being told to relax! But the beat is where I need it to be so it's worth a point.,40da6a2d5b204e1a865d8b31e98c43c9
spotify:track:6MCYY4i1zrRIbVj9YlVUdF,b980e47a32c74ddb9f30e77e1959157a,2022-01-28T05:44:31Z,2,Oddly works.,40da6a2d5b204e1a865d8b31e98c43c9
spotify:track:19NQ0LL9TbSgqPzidSwGMU,da5f8027cd7b421998ef6b381ebe6256,2022-01-28T06:51:45Z,0,The droning (hurdy gurdy?) is actually kind of stressful to me,40da6a2d5b204e1a865d8b31e98c43c9
spotify:track:1IsGA5ceSC4a5nxgAEYnQd,da5f8027cd7b421998ef6b381ebe6256,2022-01-28T06:51:45Z,0,"While I really like the song, not sure it fits the theme for me",40da6a2d5b204e1a865d8b31e98c43c9
spotify:track:1SJhYNxOZSItqrB6upWyE6,da5f8027cd7b421998ef6b381ebe6256,2022-01-28T06:51:45Z,2,Their voices are very soothing,40da6a2d5b204e1a865d8b31e98c43c9
spotify:track:27NovPIUIRrOZoCHxABJwK,da5f8027cd7b421998ef6b381ebe6256,2022-01-28T06:51:45Z,1,I think I see where you were going with the lyrics,40da6a2d5b204e1a865d8b31e98c43c9
spotify:track:2rtGaCAeYtmcIvuZsvgTf6,da5f8027cd7b421998ef6b381ebe6256,2022-01-28T06:51:45Z,2,Pretty chill (except that bit near the end) and title/lyrics are pretty relevant,40da6a2d5b204e1a865d8b31e98c43c9
spotify:track:2T5Ch09nefwckOu5NQvjIk,da5f8027cd7b421998ef6b381ebe6256,2022-01-28T06:51:45Z,1,"Definitely a chill song, although the lyrics might encourage walking off the job",40da6a2d5b204e1a865d8b31e98c43c9
spotify:track:2zfJ7nQiIGfy6BRuMuuLSX,da5f8027cd7b421998ef6b381ebe6256,2022-01-28T06:51:45Z,1,"The music isn't very chill especially as the song goes on, but it does tell you to take it easy...",40da6a2d5b204e1a865d8b31e98c43c9
spotify:track:5JFkuKQsPps2ZaZzaLx63d,da5f8027cd7b421998ef6b381ebe6256,2022-01-28T06:51:45Z,0,"If the bass drops, that doesn't really encourage chilling out to me",40da6a2d5b204e1a865d8b31e98c43c9
spotify:track:5W8YXBz9MTIDyrpYaCg2Ky,da5f8027cd7b421998ef6b381ebe6256,2022-01-28T06:51:45Z,0,This song has no chill for me,40da6a2d5b204e1a865d8b31e98c43c9
spotify:track:5WJ92b9eMC0xZ7BaukU1E4,da5f8027cd7b421998ef6b381ebe6256,2022-01-28T06:51:45Z,0,A song about delaying orgasm that I presume was chosen just for the title?,40da6a2d5b204e1a865d8b31e98c43c9
spotify:track:6MCYY4i1zrRIbVj9YlVUdF,da5f8027cd7b421998ef6b381ebe6256,2022-01-28T06:51:45Z,0,"While I like this song a lot, not sure it really fits for me",40da6a2d5b204e1a865d8b31e98c43c9
spotify:track:7rlCeTnjn0plPZkVAcctPZ,da5f8027cd7b421998ef6b381ebe6256,2022-01-28T06:51:45Z,3,"I don't know if the music helps chill out, but the lyrics definitely remind you not to walk off the job",40da6a2d5b204e1a865d8b31e98c43c9
spotify:track:19NQ0LL9TbSgqPzidSwGMU,395e5c719c574cbd81ec148a0e6a28c6,2022-01-28T07:51:03Z,1,"I guess the lyrics help remind us that our jobs are meaningless bullshit in comparison to the rest of the heavens, but I'd like more swearing to really hammer the point home",40da6a2d5b204e1a865d8b31e98c43c9
spotify:track:1diS6nkxMQc3wwC4G1j0bh,395e5c719c574cbd81ec148a0e6a28c6,2022-01-28T07:51:03Z,0,"If she's speaking to her job, she's actually telling her job she's leaving.  The round is songs that WON'T make you walk off the job.",40da6a2d5b204e1a865d8b31e98c43c9
spotify:track:1IsGA5ceSC4a5nxgAEYnQd,395e5c719c574cbd81ec148a0e6a28c6,2022-01-28T07:51:03Z,0,"This song's lyrics are like ""You should be miserable"" and that's definitely not going to stop me for walking off the job.",40da6a2d5b204e1a865d8b31e98c43c9
spotify:track:1SJhYNxOZSItqrB6upWyE6,395e5c719c574cbd81ec148a0e6a28c6,2022-01-28T07:51:03Z,3,"ong provides perspective and has a mellow vibe.  Sure, have points.",40da6a2d5b204e1a865d8b31e98c43c9
spotify:track:27NovPIUIRrOZoCHxABJwK,395e5c719c574cbd81ec148a0e6a28c6,2022-01-28T07:51:03Z,0,This song drives me bonkers.  I'd rather work for 8 hours than listen to this for 8 hours.,40da6a2d5b204e1a865d8b31e98c43c9
spotify:track:2rtGaCAeYtmcIvuZsvgTf6,395e5c719c574cbd81ec148a0e6a28c6,2022-01-28T07:51:03Z,3,"Relevant to the theme, trance-inducing",40da6a2d5b204e1a865d8b31e98c43c9
spotify:track:2zfJ7nQiIGfy6BRuMuuLSX,395e5c719c574cbd81ec148a0e6a28c6,2022-01-28T07:51:03Z,1,"Fond feelings for ""Pippin"" (my 9th grade show). I guess if I'm busy making jazz hands I'm not walking off the job.",40da6a2d5b204e1a865d8b31e98c43c9
spotify:track:5ARrtxJLVCeTv5TWo1oKgC,395e5c719c574cbd81ec148a0e6a28c6,2022-01-28T07:51:03Z,1,"It has too much treble to actually chill me out, but lyrics are applicable to theme, so yes have a point",40da6a2d5b204e1a865d8b31e98c43c9
spotify:track:5JFkuKQsPps2ZaZzaLx63d,395e5c719c574cbd81ec148a0e6a28c6,2022-01-28T07:51:03Z,0,I have always enjoyed Lindsey Stirling's violin playing.  The drumbeat and mixing is cringe-inducing though - I would walk off the job to get away from them.,40da6a2d5b204e1a865d8b31e98c43c9
spotify:track:5W8YXBz9MTIDyrpYaCg2Ky,395e5c719c574cbd81ec148a0e6a28c6,2022-01-28T07:51:03Z,0,Oooh fucking dark song.  All the suicide references would make me walk off the job.,40da6a2d5b204e1a865d8b31e98c43c9
spotify:track:5WJ92b9eMC0xZ7BaukU1E4,395e5c719c574cbd81ec148a0e6a28c6,2022-01-28T07:51:03Z,0,"No no no no this song makes you think a lot about sex, it doesn't mellow you out!",40da6a2d5b204e1a865d8b31e98c43c9
spotify:track:6MCYY4i1zrRIbVj9YlVUdF,395e5c719c574cbd81ec148a0e6a28c6,2022-01-28T07:51:03Z,0,I like the horns a lot.  I didn't understand the meaning of the lyrics though.,40da6a2d5b204e1a865d8b31e98c43c9
spotify:track:7rlCeTnjn0plPZkVAcctPZ,395e5c719c574cbd81ec148a0e6a28c6,2022-01-28T07:51:03Z,1,"A reminder of why one should not walk off the job - we got them bills.  The beat is bouncy but the background instruments delivered feelings of anxiety rather than chill though, so only 1 point here.",40da6a2d5b204e1a865d8b31e98c43c9
spotify:track:19NQ0LL9TbSgqPzidSwGMU,a75a5cd99eaa40a6868c250adaa7a673,2022-01-28T08:43:27Z,0,i like how chill the song is but the drone in the background would drive me up a wall if i was about to walk out,40da6a2d5b204e1a865d8b31e98c43c9
spotify:track:1diS6nkxMQc3wwC4G1j0bh,a75a5cd99eaa40a6868c250adaa7a673,2022-01-28T08:43:27Z,0,this song would convince me to walk off the job,40da6a2d5b204e1a865d8b31e98c43c9
spotify:track:1SJhYNxOZSItqrB6upWyE6,a75a5cd99eaa40a6868c250adaa7a673,2022-01-28T08:43:27Z,1,"i love this sumbission for so many things, keep me chill before a fight, before making any rash decisions. great vibes",40da6a2d5b204e1a865d8b31e98c43c9
spotify:track:27NovPIUIRrOZoCHxABJwK,a75a5cd99eaa40a6868c250adaa7a673,2022-01-28T08:43:27Z,0,"i really love nas X and his music but i really disliked harlow's bars in this song. in general i have liked harlows music outside of this but this one really let me down. love the vibe but it fires me up not calms me down, id probably confront the boss ",40da6a2d5b204e1a865d8b31e98c43c9
spotify:track:2rtGaCAeYtmcIvuZsvgTf6,a75a5cd99eaa40a6868c250adaa7a673,2022-01-28T08:43:27Z,1,very chill lyrical content on point. great submission,40da6a2d5b204e1a865d8b31e98c43c9
spotify:track:2T5Ch09nefwckOu5NQvjIk,a75a5cd99eaa40a6868c250adaa7a673,2022-01-28T08:43:27Z,0,i have no feelings of carolina but i love the idea of being wherever we feel most at home in our heads to help calm down,40da6a2d5b204e1a865d8b31e98c43c9
spotify:track:2zfJ7nQiIGfy6BRuMuuLSX,a75a5cd99eaa40a6868c250adaa7a673,2022-01-28T08:43:27Z,0,haha this song would make me want to dance isntead of walk off so it's working there!,40da6a2d5b204e1a865d8b31e98c43c9
spotify:track:5ARrtxJLVCeTv5TWo1oKgC,a75a5cd99eaa40a6868c250adaa7a673,2022-01-28T08:43:27Z,1,"great vibes, i might actully add this to  work playlist!",40da6a2d5b204e1a865d8b31e98c43c9
spotify:track:5JFkuKQsPps2ZaZzaLx63d,a75a5cd99eaa40a6868c250adaa7a673,2022-01-28T08:43:27Z,2,her live performance of this in her home for the holidays show is absolutly worth the watch! so amazing! then watching the behind the scenes made it even better if lindsey can do this then i'm for sure not waling off the job!,40da6a2d5b204e1a865d8b31e98c43c9
spotify:track:5WJ92b9eMC0xZ7BaukU1E4,a75a5cd99eaa40a6868c250adaa7a673,2022-01-28T08:43:27Z,4,perfect,40da6a2d5b204e1a865d8b31e98c43c9
spotify:track:7rlCeTnjn0plPZkVAcctPZ,a75a5cd99eaa40a6868c250adaa7a673,2022-01-28T08:43:27Z,1,really enjoyed the upbeat and positive nature of this song even when talking about a hard thing,40da6a2d5b204e1a865d8b31e98c43c9
spotify:track:2rtGaCAeYtmcIvuZsvgTf6,d21152e7d3cd4a69b0951abdfe3e1480,2022-01-28T09:20:26Z,2,,40da6a2d5b204e1a865d8b31e98c43c9
spotify:track:2T5Ch09nefwckOu5NQvjIk,d21152e7d3cd4a69b0951abdfe3e1480,2022-01-28T09:20:26Z,4,,40da6a2d5b204e1a865d8b31e98c43c9
spotify:track:2zfJ7nQiIGfy6BRuMuuLSX,d21152e7d3cd4a69b0951abdfe3e1480,2022-01-28T09:20:26Z,1,,40da6a2d5b204e1a865d8b31e98c43c9
spotify:track:6MCYY4i1zrRIbVj9YlVUdF,d21152e7d3cd4a69b0951abdfe3e1480,2022-01-28T09:20:26Z,1,,40da6a2d5b204e1a865d8b31e98c43c9
spotify:track:7rlCeTnjn0plPZkVAcctPZ,d21152e7d3cd4a69b0951abdfe3e1480,2022-01-28T09:20:26Z,2,I don't actually think you could listen to this and not suddenly get a smile on your face,40da6a2d5b204e1a865d8b31e98c43c9
spotify:track:1IsGA5ceSC4a5nxgAEYnQd,9e5c0f25c78544de921a2a52b9412022,2022-01-28T20:05:15Z,1,,40da6a2d5b204e1a865d8b31e98c43c9
spotify:track:27NovPIUIRrOZoCHxABJwK,9e5c0f25c78544de921a2a52b9412022,2022-01-28T20:05:15Z,1,,40da6a2d5b204e1a865d8b31e98c43c9
spotify:track:2T5Ch09nefwckOu5NQvjIk,9e5c0f25c78544de921a2a52b9412022,2022-01-28T20:05:15Z,1,,40da6a2d5b204e1a865d8b31e98c43c9
spotify:track:5W8YXBz9MTIDyrpYaCg2Ky,9e5c0f25c78544de921a2a52b9412022,2022-01-28T20:05:15Z,3,I considered this song and am impressed with my self control in only giving it 3 points.,40da6a2d5b204e1a865d8b31e98c43c9
spotify:track:5WJ92b9eMC0xZ7BaukU1E4,9e5c0f25c78544de921a2a52b9412022,2022-01-28T20:05:15Z,2,Fitting and effective.,40da6a2d5b204e1a865d8b31e98c43c9
spotify:track:7rlCeTnjn0plPZkVAcctPZ,9e5c0f25c78544de921a2a52b9412022,2022-01-28T20:05:15Z,2,Fitting and effective,40da6a2d5b204e1a865d8b31e98c43c9
spotify:track:1diS6nkxMQc3wwC4G1j0bh,e1a362ba4ee648dd9f6f5e72bba8144a,2022-01-28T21:25:27Z,2,,40da6a2d5b204e1a865d8b31e98c43c9
spotify:track:27NovPIUIRrOZoCHxABJwK,e1a362ba4ee648dd9f6f5e72bba8144a,2022-01-28T21:25:27Z,2,,40da6a2d5b204e1a865d8b31e98c43c9
spotify:track:2T5Ch09nefwckOu5NQvjIk,e1a362ba4ee648dd9f6f5e72bba8144a,2022-01-28T21:25:27Z,2,,40da6a2d5b204e1a865d8b31e98c43c9
spotify:track:5JFkuKQsPps2ZaZzaLx63d,e1a362ba4ee648dd9f6f5e72bba8144a,2022-01-28T21:25:27Z,2,,40da6a2d5b204e1a865d8b31e98c43c9
spotify:track:6MCYY4i1zrRIbVj9YlVUdF,e1a362ba4ee648dd9f6f5e72bba8144a,2022-01-28T21:25:27Z,2,,40da6a2d5b204e1a865d8b31e98c43c9
spotify:track:19NQ0LL9TbSgqPzidSwGMU,a2fc223a9f144363a5263c63b718a7b9,2022-01-28T21:27:47Z,1,,40da6a2d5b204e1a865d8b31e98c43c9
spotify:track:1IsGA5ceSC4a5nxgAEYnQd,a2fc223a9f144363a5263c63b718a7b9,2022-01-28T21:27:47Z,1,,40da6a2d5b204e1a865d8b31e98c43c9
spotify:track:1SJhYNxOZSItqrB6upWyE6,a2fc223a9f144363a5263c63b718a7b9,2022-01-28T21:27:47Z,1,,40da6a2d5b204e1a865d8b31e98c43c9
spotify:track:2rtGaCAeYtmcIvuZsvgTf6,a2fc223a9f144363a5263c63b718a7b9,2022-01-28T21:27:47Z,2,,40da6a2d5b204e1a865d8b31e98c43c9
spotify:track:2T5Ch09nefwckOu5NQvjIk,a2fc223a9f144363a5263c63b718a7b9,2022-01-28T21:27:47Z,1,,40da6a2d5b204e1a865d8b31e98c43c9
spotify:track:5ARrtxJLVCeTv5TWo1oKgC,a2fc223a9f144363a5263c63b718a7b9,2022-01-28T21:27:47Z,1,,40da6a2d5b204e1a865d8b31e98c43c9
spotify:track:5W8YXBz9MTIDyrpYaCg2Ky,a2fc223a9f144363a5263c63b718a7b9,2022-01-28T21:27:47Z,0,Instructions unclear. I have rage quit my job. ,40da6a2d5b204e1a865d8b31e98c43c9
spotify:track:5WJ92b9eMC0xZ7BaukU1E4,a2fc223a9f144363a5263c63b718a7b9,2022-01-28T21:27:47Z,1,,40da6a2d5b204e1a865d8b31e98c43c9
spotify:track:7rlCeTnjn0plPZkVAcctPZ,a2fc223a9f144363a5263c63b718a7b9,2022-01-28T21:27:47Z,2,,40da6a2d5b204e1a865d8b31e98c43c9
spotify:track:0H2bTNmeaD2Jqia7KDp04a,36d943fd539042239fb5646d50d0a9ad,2022-02-01T21:22:23Z,5,"I don't even like this song but it's the only one that really nails the prompt, so well done.  (Did you know this song or did you use a lyric search engine?)",7df6b6d3b19e442192c80fa155562414
spotify:track:7quBiDUDKznmbCLDjjIUdm,36d943fd539042239fb5646d50d0a9ad,2022-02-01T21:22:23Z,5,Love the sad mopey vibes...will have to learn more about this artist!,7df6b6d3b19e442192c80fa155562414
spotify:track:2Z1X3XvQhsaOysMOKJ0CLf,ee68d303b28a4bad8e749d599ee7ea1d,2022-02-01T21:41:41Z,1,,7df6b6d3b19e442192c80fa155562414
spotify:track:265Anh9hGoozFigjUVLUeD,ee68d303b28a4bad8e749d599ee7ea1d,2022-02-01T21:41:41Z,1,,7df6b6d3b19e442192c80fa155562414
spotify:track:0s9aeZriwqyBYfxFzsd20R,ee68d303b28a4bad8e749d599ee7ea1d,2022-02-01T21:41:41Z,3,,7df6b6d3b19e442192c80fa155562414
spotify:track:0H2bTNmeaD2Jqia7KDp04a,ee68d303b28a4bad8e749d599ee7ea1d,2022-02-01T21:41:41Z,1,,7df6b6d3b19e442192c80fa155562414
spotify:track:6WGaVdhY8uMWMgxiKpdLVy,ee68d303b28a4bad8e749d599ee7ea1d,2022-02-01T21:41:41Z,2,,7df6b6d3b19e442192c80fa155562414
spotify:track:64rMBgXnYB3zU2oOvlxrc2,ee68d303b28a4bad8e749d599ee7ea1d,2022-02-01T21:41:41Z,1,,7df6b6d3b19e442192c80fa155562414
spotify:track:4fouWK6XVHhzl78KzQ1UjL,ee68d303b28a4bad8e749d599ee7ea1d,2022-02-01T21:41:41Z,1,,7df6b6d3b19e442192c80fa155562414
spotify:track:1uu5vD0Vem9ij6T2rPDpew,b0415b544bb44324a6afca46625ea1a7,2022-02-01T21:50:56Z,1,"Paddy, I think you're just flexing at this point by picking all this traditional folk music at this point. I'll throw you a point for consistency.",7df6b6d3b19e442192c80fa155562414
spotify:track:1OrBPFs8yLkT02aLiloHQs,b0415b544bb44324a6afca46625ea1a7,2022-02-01T21:50:56Z,3,One of the few songs I liked on this playlist. Congrats.,7df6b6d3b19e442192c80fa155562414
spotify:track:4yEoBe0b9paEGQrUIGxBCb,b0415b544bb44324a6afca46625ea1a7,2022-02-01T21:50:56Z,3,:shrug emoji:,7df6b6d3b19e442192c80fa155562414
spotify:track:4fouWK6XVHhzl78KzQ1UjL,b0415b544bb44324a6afca46625ea1a7,2022-02-01T21:50:56Z,3,One of the few songs I liked on this playlist. Congrats.,7df6b6d3b19e442192c80fa155562414
spotify:track:4yEoBe0b9paEGQrUIGxBCb,b980e47a32c74ddb9f30e77e1959157a,2022-02-02T02:32:52Z,0,"I get it, I just can't get behind it.",7df6b6d3b19e442192c80fa155562414
spotify:track:4fouWK6XVHhzl78KzQ1UjL,b980e47a32c74ddb9f30e77e1959157a,2022-02-02T02:32:52Z,0,"I want to give this points for ""Everybody but your dog, you can all fuck off"" alone, but if I'm going off the prompt I can't.",7df6b6d3b19e442192c80fa155562414
spotify:track:2Z1X3XvQhsaOysMOKJ0CLf,b980e47a32c74ddb9f30e77e1959157a,2022-02-02T02:32:52Z,0,"A miss for me, sorry.",7df6b6d3b19e442192c80fa155562414
spotify:track:265Anh9hGoozFigjUVLUeD,b980e47a32c74ddb9f30e77e1959157a,2022-02-02T02:32:52Z,0,"A fan, but there's some stiff competition this round.",7df6b6d3b19e442192c80fa155562414
spotify:track:1vG5t1ZJxlMNo0VqSuPMzb,b980e47a32c74ddb9f30e77e1959157a,2022-02-02T02:32:52Z,0,"Hauntingly beautiful. Wrong flavor of ""everything's fine"".",7df6b6d3b19e442192c80fa155562414
spotify:track:1uu5vD0Vem9ij6T2rPDpew,b980e47a32c74ddb9f30e77e1959157a,2022-02-02T02:32:52Z,0,"Love it, but just too fun for what the prompt is to me.",7df6b6d3b19e442192c80fa155562414
spotify:track:1OrBPFs8yLkT02aLiloHQs,b980e47a32c74ddb9f30e77e1959157a,2022-02-02T02:32:52Z,5,I want to click the + button more! Why won't it let me click the button more?!,7df6b6d3b19e442192c80fa155562414
spotify:track:1J57P3cwltq4OG9flDTc12,b980e47a32c74ddb9f30e77e1959157a,2022-02-02T02:32:52Z,0,"Great song, but a level of optimism that the prompt doesn't give me.",7df6b6d3b19e442192c80fa155562414
spotify:track:0s9aeZriwqyBYfxFzsd20R,b980e47a32c74ddb9f30e77e1959157a,2022-02-02T02:32:52Z,1,"Love this song, and ""The scene ends badly as you might imagine, In a cavalcade of anger and fear"" is just enough for me to reach ""EVERYTHING'S FUCKING FINE"".",7df6b6d3b19e442192c80fa155562414
spotify:track:0iq3MFEbuKTWJgdhwdOwXI,b980e47a32c74ddb9f30e77e1959157a,2022-02-02T02:32:52Z,3,"Manic, overwhelmed, and medicated. Everything is fucking fine!",7df6b6d3b19e442192c80fa155562414
spotify:track:0H2bTNmeaD2Jqia7KDp04a,b980e47a32c74ddb9f30e77e1959157a,2022-02-02T02:32:52Z,1,"Dig the beat, but the ""What's wrong""s make my blood boil, and it is not fine.",7df6b6d3b19e442192c80fa155562414
spotify:track:7quBiDUDKznmbCLDjjIUdm,b980e47a32c74ddb9f30e77e1959157a,2022-02-02T02:32:52Z,0,"Again, good song, but missing a key word.",7df6b6d3b19e442192c80fa155562414
spotify:track:64rMBgXnYB3zU2oOvlxrc2,b980e47a32c74ddb9f30e77e1959157a,2022-02-02T02:32:52Z,0,Another missing the punch I'm looking for.,7df6b6d3b19e442192c80fa155562414
spotify:track:1OrBPFs8yLkT02aLiloHQs,a75a5cd99eaa40a6868c250adaa7a673,2022-02-02T05:34:12Z,1,this song made me happy ,7df6b6d3b19e442192c80fa155562414
spotify:track:0H2bTNmeaD2Jqia7KDp04a,a75a5cd99eaa40a6868c250adaa7a673,2022-02-02T05:34:12Z,3,i like the groove on this,7df6b6d3b19e442192c80fa155562414
spotify:track:6WGaVdhY8uMWMgxiKpdLVy,a75a5cd99eaa40a6868c250adaa7a673,2022-02-02T05:34:12Z,5,"perfect submission, im mad i didnt think to post it!",7df6b6d3b19e442192c80fa155562414
spotify:track:1vG5t1ZJxlMNo0VqSuPMzb,a75a5cd99eaa40a6868c250adaa7a673,2022-02-02T05:34:12Z,0,nice really really nice,7df6b6d3b19e442192c80fa155562414
spotify:track:1J57P3cwltq4OG9flDTc12,a75a5cd99eaa40a6868c250adaa7a673,2022-02-02T05:34:12Z,1,i really enjoyed this song.,7df6b6d3b19e442192c80fa155562414
spotify:track:2Z1X3XvQhsaOysMOKJ0CLf,e1a362ba4ee648dd9f6f5e72bba8144a,2022-02-03T15:28:06Z,3,love this song!,7df6b6d3b19e442192c80fa155562414
spotify:track:1vG5t1ZJxlMNo0VqSuPMzb,e1a362ba4ee648dd9f6f5e72bba8144a,2022-02-03T15:28:06Z,2,"how dare this song, how very dare",7df6b6d3b19e442192c80fa155562414
spotify:track:0s9aeZriwqyBYfxFzsd20R,e1a362ba4ee648dd9f6f5e72bba8144a,2022-02-03T15:28:06Z,1,"That chorus, let's sing it all year lol",7df6b6d3b19e442192c80fa155562414
spotify:track:0H2bTNmeaD2Jqia7KDp04a,e1a362ba4ee648dd9f6f5e72bba8144a,2022-02-03T15:28:06Z,4,I liked this one a lot!! Great vibe,7df6b6d3b19e442192c80fa155562414
spotify:track:265Anh9hGoozFigjUVLUeD,e1a362ba4ee648dd9f6f5e72bba8144a,2022-02-03T15:28:06Z,0,I thought this was a bop! For me this is a song I'd play when I'm already in a good mood.,7df6b6d3b19e442192c80fa155562414
spotify:track:4fouWK6XVHhzl78KzQ1UjL,395e5c719c574cbd81ec148a0e6a28c6,2022-02-03T15:29:15Z,1,Not quite sure it fit the theme but there's a special place in my heart for good breakup songs and I love songs littered with profanity. ,7df6b6d3b19e442192c80fa155562414
spotify:track:0H2bTNmeaD2Jqia7KDp04a,395e5c719c574cbd81ec148a0e6a28c6,2022-02-03T15:29:15Z,1,"Lyrics fit the theme really really well, but repeated ""What's Wrong"" got on my nerves.  I am giving it 1 point even though I don't want to, but I have all these excess points that I have to get rid of.",7df6b6d3b19e442192c80fa155562414
spotify:track:0iq3MFEbuKTWJgdhwdOwXI,395e5c719c574cbd81ec148a0e6a28c6,2022-02-03T15:29:15Z,0,Oooh good clash of dark sentiment and upbeat rhythms.  Fits theme well.  I'm just not a fan of the idea of drugging yourself to feel good.,7df6b6d3b19e442192c80fa155562414
spotify:track:0s9aeZriwqyBYfxFzsd20R,395e5c719c574cbd81ec148a0e6a28c6,2022-02-03T15:29:15Z,0,"""I am going to make it through this year if it kills me"" is very fitting for the times.  Song hits the ""things are bad"" aspect, but I wanted a little more ""It'll be okay""",7df6b6d3b19e442192c80fa155562414
spotify:track:1J57P3cwltq4OG9flDTc12,395e5c719c574cbd81ec148a0e6a28c6,2022-02-03T15:29:15Z,1,"Not a fan of the performance, but the point got across.  1 point because it doesn't have a whole lot of the ""it's going to be fine"" factor.  Instead it's just like, ""It's going to be"".",7df6b6d3b19e442192c80fa155562414
spotify:track:1OrBPFs8yLkT02aLiloHQs,395e5c719c574cbd81ec148a0e6a28c6,2022-02-03T15:29:15Z,0,I like the lyrics about faking it as you fight your way through.  But I did not like the military drummer boy percussion at all.,7df6b6d3b19e442192c80fa155562414
spotify:track:1uu5vD0Vem9ij6T2rPDpew,395e5c719c574cbd81ec148a0e6a28c6,2022-02-03T15:29:15Z,1,"My favorite lines: ""There are weasels in the office"" and ""There's a banker finding ways to store your money in a sieve"".  Indeed.  Needed a little more silver lining for me though.",7df6b6d3b19e442192c80fa155562414
spotify:track:1vG5t1ZJxlMNo0VqSuPMzb,395e5c719c574cbd81ec148a0e6a28c6,2022-02-03T15:29:15Z,0,"Eurovision shmaltzy, and lyrics didn't really feel to me like it fit theme. ",7df6b6d3b19e442192c80fa155562414
spotify:track:2Z1X3XvQhsaOysMOKJ0CLf,395e5c719c574cbd81ec148a0e6a28c6,2022-02-03T15:29:15Z,0,The fun beat makes me smile.  I'm not sure I understand the meaning of the song though.,7df6b6d3b19e442192c80fa155562414
spotify:track:4yEoBe0b9paEGQrUIGxBCb,395e5c719c574cbd81ec148a0e6a28c6,2022-02-03T15:29:15Z,3,"Perfect embodiment of the theme, and very catchy to boot.  Whistle to convince yourself everything's fucking fine.  Death's coming for us all anyway.",7df6b6d3b19e442192c80fa155562414
spotify:track:64rMBgXnYB3zU2oOvlxrc2,395e5c719c574cbd81ec148a0e6a28c6,2022-02-03T15:29:15Z,1,One of those songs that was clearly written about something specific but details are kept vague to the point where it's hard to understand what the song is actually about.  Point for tone though.,7df6b6d3b19e442192c80fa155562414
spotify:track:6WGaVdhY8uMWMgxiKpdLVy,395e5c719c574cbd81ec148a0e6a28c6,2022-02-03T15:29:15Z,2,Lyrics on point with the theme.  Song makes up for the boring parts by picking up at the rock-and-roll parts.,7df6b6d3b19e442192c80fa155562414
spotify:track:7quBiDUDKznmbCLDjjIUdm,395e5c719c574cbd81ec148a0e6a28c6,2022-02-03T15:29:15Z,0,"It does the ""I'm hurting"" part well.  But this is more of a commiserating song rather than one that pretends things are okay or says things will still be okay.",7df6b6d3b19e442192c80fa155562414
spotify:track:1uu5vD0Vem9ij6T2rPDpew,b1d3b6bb237f476daab860bce327dbd6,2022-02-03T17:13:18Z,2,"Super fun, never heard this before! Big fan.",7df6b6d3b19e442192c80fa155562414
spotify:track:0s9aeZriwqyBYfxFzsd20R,b1d3b6bb237f476daab860bce327dbd6,2022-02-03T17:13:18Z,1,"Never heard this before, but I love it! Very fitting and a fun listen.",7df6b6d3b19e442192c80fa155562414
spotify:track:2Z1X3XvQhsaOysMOKJ0CLf,b1d3b6bb237f476daab860bce327dbd6,2022-02-03T17:13:18Z,0,I hate LA. No points on principle.,7df6b6d3b19e442192c80fa155562414
